{
  "spec_version": "1.1",
  "tool_version": "1.0.0",
  "checks_version": "6",
  "receipt_id": "384539fa-5d19-4f44-aff1-19f278fed493",
  "receipt_fingerprint": "044954cc05ebe5e8",
  "full_fingerprint": "044954cc05ebe5e806a86c06b352259538e66921b1c737470596100a978016ea",
  "correlation_id": "golden-003-pass-technical-hedged",
  "timestamp": "2026-02-17T00:00:00+00:00",
  "inputs": {
    "query": "database migration impact",
    "context": "Database migrations can cause downtime. Index rebuilds may be required. Estimated time depends on table size and index count."
  },
  "outputs": {
    "response": "The migration may cause temporary downtime. It's possible that some indexes could need rebuilding, but this likely won't exceed 15 minutes based on similar migrations."
  },
  "context_hash": "274335621b7c39884adbabbf9a9835c8dfb33fc19454815eeada4763579a5db0",
  "output_hash": "9848907ca4256fe451152195aa240d5f29c30f2971ada87669a9ba78e953d181",
  "checks": [
    {
      "check_id": "C1",
      "name": "Context Contradiction",
      "passed": true,
      "severity": "info",
      "evidence": null,
      "details": "No obvious contradiction detected (heuristic check)"
    },
    {
      "check_id": "C2",
      "name": "Mark Inferences",
      "passed": true,
      "severity": "info",
      "evidence": null,
      "details": "Inference marking appears adequate (heuristic check)"
    },
    {
      "check_id": "C3",
      "name": "No False Certainty",
      "passed": true,
      "severity": "info",
      "evidence": null,
      "details": "Certainty level appears appropriate (heuristic check)"
    },
    {
      "check_id": "C4",
      "name": "Preserve Tensions",
      "passed": true,
      "severity": "info",
      "evidence": null,
      "details": "No obvious conflict collapse detected (heuristic check)"
    },
    {
      "check_id": "C5",
      "name": "No Premature Compression",
      "passed": true,
      "severity": "info",
      "evidence": null,
      "details": "Compression level appears appropriate (heuristic check)"
    }
  ],
  "checks_passed": 5,
  "checks_failed": 0,
  "status": "PASS",
  "constitution_ref": null,
  "enforcement": null
}