{
  "spec_version": "1.1",
  "tool_version": "1.0.0",
  "checks_version": "6",
  "receipt_id": "f8951681-e38c-4f4c-a760-7d6c58cc30a6",
  "receipt_fingerprint": "bc9844b172f99bdf",
  "full_fingerprint": "bc9844b172f99bdfbff2c65fd64ecff571508d811d28156833b719f022c0aa54",
  "correlation_id": "golden-006-warn-c3-certainty",
  "timestamp": "2026-02-17T00:00:00+00:00",
  "inputs": {
    "query": "API free tier",
    "context": "Free tier available if usage is under 1000 requests/month. Requires API key registration. Rate limits apply. Exceeding limits requires paid plan upgrade."
  },
  "outputs": {
    "response": "You can use the API for free. Go ahead and start making requests immediately."
  },
  "context_hash": "574dae21369e5d972bef4f0e95667209d95839bdf2b98872a9ef32685b2a7995",
  "output_hash": "cb01811aad8717a596208a0d413afc32655712ac4847621459df2071d43c3ab5",
  "checks": [
    {
      "check_id": "C1",
      "name": "Context Contradiction",
      "passed": true,
      "severity": "info",
      "evidence": null,
      "details": "No obvious contradiction detected (heuristic check)"
    },
    {
      "check_id": "C2",
      "name": "Mark Inferences",
      "passed": true,
      "severity": "info",
      "evidence": null,
      "details": "Inference marking appears adequate (heuristic check)"
    },
    {
      "check_id": "C3",
      "name": "No False Certainty",
      "passed": false,
      "severity": "warning",
      "evidence": "Confident claim without acknowledging conditions: \"you can\"",
      "details": "Output confidence may exceed evidence support"
    },
    {
      "check_id": "C4",
      "name": "Preserve Tensions",
      "passed": true,
      "severity": "info",
      "evidence": null,
      "details": "No obvious conflict collapse detected (heuristic check)"
    },
    {
      "check_id": "C5",
      "name": "No Premature Compression",
      "passed": true,
      "severity": "info",
      "evidence": null,
      "details": "Compression level appears appropriate (heuristic check)"
    }
  ],
  "checks_passed": 4,
  "checks_failed": 1,
  "status": "WARN",
  "constitution_ref": null,
  "enforcement": null
}