{
  "spec_version": "1.1",
  "tool_version": "1.0.0",
  "checks_version": "6",
  "receipt_id": "5de34bd2-a571-4b69-aa1d-8af4f8c851e6",
  "receipt_fingerprint": "474f1ba480d77e6e",
  "full_fingerprint": "474f1ba480d77e6e1d4d0bbeebe9ab6d6c2d8c7710ba9837bc238cc0a2e66be0",
  "correlation_id": "golden-007-warn-c5-compression",
  "timestamp": "2026-02-17T00:00:00+00:00",
  "inputs": {
    "query": "deployment options",
    "context": "Deployment options include:\n- AWS with auto-scaling groups\n- GCP with Kubernetes Engine\n- Azure with App Service\n- On-premise with Docker Compose\n- Hybrid cloud with VPN tunneling\nEach option has different cost, latency, and compliance implications."
  },
  "outputs": {
    "response": "Deploy to cloud."
  },
  "context_hash": "0a1a978e251057524cd8335ba7c1d45d827e9f6cab4a0e80c5553628938f211d",
  "output_hash": "260194464445f7e3167ef9ccda4b9858902ee953dd94c32d580d22ff6b5738d4",
  "checks": [
    {
      "check_id": "C1",
      "name": "Context Contradiction",
      "passed": true,
      "severity": "info",
      "evidence": null,
      "details": "No obvious contradiction detected (heuristic check)"
    },
    {
      "check_id": "C2",
      "name": "Mark Inferences",
      "passed": true,
      "severity": "info",
      "evidence": null,
      "details": "Inference marking appears adequate (heuristic check)"
    },
    {
      "check_id": "C3",
      "name": "No False Certainty",
      "passed": true,
      "severity": "info",
      "evidence": null,
      "details": "Certainty level appears appropriate (heuristic check)"
    },
    {
      "check_id": "C4",
      "name": "Preserve Tensions",
      "passed": true,
      "severity": "info",
      "evidence": null,
      "details": "No obvious conflict collapse detected (heuristic check)"
    },
    {
      "check_id": "C5",
      "name": "No Premature Compression",
      "passed": false,
      "severity": "warning",
      "evidence": "Context has ~5 points, output has 1 sentences",
      "details": "Output may over-compress multi-faceted context"
    }
  ],
  "checks_passed": 4,
  "checks_failed": 1,
  "status": "WARN",
  "constitution_ref": null,
  "enforcement": null
}