{
  "spec_version": "1.1",
  "tool_version": "1.0.0",
  "checks_version": "6",
  "receipt_id": "a0000007-0000-4000-8000-000000000007",
  "receipt_fingerprint": "2d6d530738b02cf6",
  "full_fingerprint": "2d6d530738b02cf66d574563f4028e3b9c53c00f044eef3677e7a9cde262df9b",
  "correlation_id": "golden-007-warn-c5-compression",
  "timestamp": "2026-01-01T00:00:00+00:00",
  "inputs": {
    "query": "Deployment options?",
    "context": "Deployment options include:\n- AWS with auto-scaling\n- GCP with managed Kubernetes\n- Azure with serverless functions\n- On-premise with Docker\nEach has different cost and performance implications."
  },
  "outputs": {
    "response": "Deploy to cloud."
  },
  "context_hash": "84e22839c23e478cc32925e4dc17bca8d9169a2ccd193a94fb49ba82c3fea0d8",
  "output_hash": "260194464445f7e3167ef9ccda4b9858902ee953dd94c32d580d22ff6b5738d4",
  "checks": [
    {
      "check_id": "C1",
      "name": "Context Contradiction",
      "passed": true,
      "severity": "info",
      "evidence": null,
      "details": "No obvious contradiction detected (heuristic check)"
    },
    {
      "check_id": "C2",
      "name": "Mark Inferences",
      "passed": true,
      "severity": "info",
      "evidence": null,
      "details": "Inference marking appears adequate (heuristic check)"
    },
    {
      "check_id": "C3",
      "name": "No False Certainty",
      "passed": true,
      "severity": "info",
      "evidence": null,
      "details": "Certainty level appears appropriate (heuristic check)"
    },
    {
      "check_id": "C4",
      "name": "Preserve Tensions",
      "passed": true,
      "severity": "info",
      "evidence": null,
      "details": "No obvious conflict collapse detected (heuristic check)"
    },
    {
      "check_id": "C5",
      "name": "No Premature Compression",
      "passed": false,
      "severity": "warning",
      "evidence": "Context has ~4 points, output has 1 sentences",
      "details": "Output may over-compress multi-faceted context"
    }
  ],
  "checks_passed": 4,
  "checks_failed": 1,
  "status": "WARN",
  "constitution_ref": null,
  "enforcement": null,
  "parent_receipts": null,
  "workflow_id": null,
  "content_mode": null,
  "content_mode_source": null
}
